<?xml version="1.0" encoding="utf-8"?>
<container xmlns="http://symfony.com/schema/dic/services" xmlns:xsi="http://www.w3.org/2001/XMLSchema-instance" xsi:schemaLocation="http://symfony.com/schema/dic/services https://symfony.com/schema/dic/services/services-1.0.xsd">
  <parameters>
    <parameter key="kernel.environment">dev</parameter>
    <parameter key="debug_enabled">true</parameter>
    <parameter key="debug_disabled">false</parameter>
    <parameter key="version" type="string">1</parameter>
    <parameter key="integer_one">1</parameter>
    <parameter key="pi">3.14</parameter>
    <parameter key="collection1" type="collection">
      <parameter key="key1">val1</parameter>
      <parameter key="key2">val2</parameter>
    </parameter>
    <parameter key="nested_collection" type="collection">
      <parameter key="key">val</parameter>
      <parameter key="child_collection" type="collection">
        <parameter key="boolean">true</parameter>
        <parameter key="float">2.18</parameter>
        <parameter key="grandchild_collection" type="collection">
          <parameter key="string">something</parameter>
        </parameter>
      </parameter>
    </parameter>
    <parameter key="env_param_bool">%env(bool:ENV_PARAM)%</parameter>
    <parameter key="env_param_string">%env(string:ENV_PARAM)%</parameter>
    <parameter key="env_param_custom_type">%env(custom_type:ENV_PARAM)%</parameter>
    <parameter key="env_param_json">%env(json:ENV_PARAM)%</parameter>
    <parameter key="env_param_enum">%env(enum:ENV_PARAM)%</parameter>
    <parameter key="env_param_url">%env(url:ENV_PARAM)%</parameter>
  </parameters>
  <services>
    <service id="doctrine.orm.entity_manager" alias="doctrine.orm.default_entity_manager" public="true"/>
    <service id="doctrine.orm.default_entity_manager" class="Doctrine\ORM\EntityManager" public="true" lazy="true">
      <tag name="container.preload" class="Doctrine\ORM\Proxy\Autoloader"/>
      <argument type="service" id="doctrine.dbal.default_connection"/>
      <argument type="service" id="doctrine.orm.default_configuration"/>
      <factory class="Doctrine\ORM\EntityManager" method="create"/>
      <configurator service="doctrine.orm.default_manager_configurator" method="configure"/>
    </service>
    <service id="foo" alias="no_such_service" public="true"/>
    <service id="service_container" class="Symfony\Component\DependencyInjection\ContainerInterface" public="true" synthetic="true"/>
    <service id="http_kernel" class="Symfony\Component\HttpKernel\HttpKernel" public="true">
      <tag name="container.hot_path"/>
      <argument type="service" id="event_dispatcher"/>
      <argument type="service" id="controller_resolver"/>
      <argument type="service" id="request_stack"/>
      <argument type="service" id="argument_resolver"/>
    </service>
    <service id="Symfony\Component\HttpKernel\HttpKernelInterface" alias="http_kernel" public="true"/>
    <service id="Foo\Bar" class="Foo\Bar" public="false"/>
    <service id="private_service" class="Foo\Bar" public="false"/>
    <service id="dummy_private_service" class="Psalm\SymfonyPsalmPlugin\Tests\Fixture\DummyPrivateService" public="false"/>
    <service id="public_service_wo_public_attr" class="Foo\Bar"/>
    <service id="wronglyNamedService" class="Foo\Bar" public="true" />
    <!-- service locator example 1 -->
    <service id="App\Controller\DummyController" class="App\Controller\DummyController">
      <tag name="container.service_subscriber"/>
      <argument type="service" id=".service_locator.123xyz.App\Controller\DummyController"/>
    </service>
    <service id=".service_locator.123xyz" class="Symfony\Component\DependencyInjection\ServiceLocator" public="false">
      <tag name="container.service_locator"/>
      <argument type="collection">
        <argument key="dummy_service_with_locator" type="service" id="dummy_private_service"/>
        <argument key="dummy_service_with_locator2" type="service" id="Psalm\SymfonyPsalmPlugin\Tests\Fixture\DummyPrivateService"/>
        <argument key="dummy_service_with_locator3" type="service_closure" id="Psalm\SymfonyPsalmPlugin\Tests\Fixture\DummyPrivateService"/>
        <argument key="validator" type="service" id="debug.validator"/>
      </argument>
    </service>
    <service id=".service_locator.123xyz.App\Controller\DummyController" class="Symfony\Component\DependencyInjection\ServiceLocator">
      <tag name="container.service_locator_context" id="App\Controller\DummyController"/>
      <argument>App\Controller\DummyController</argument>
      <argument type="service" id="service_container"/>
      <factory service=".service_locator.123xyz" method="withContext"/>
    </service>
    <!-- service locator example 2 -->
    <service id="service_subscriber_2" class="App\SomeClass" autowire="true" autoconfigure="true">
      <tag name="container.service_subscriber"/>
      <argument type="service" id=".service_locator.456xyz.service_subscriber_2"/>
    </service>
    <service id=".service_locator.456xyz.service_subscriber_2" class="Symfony\Component\DependencyInjection\ServiceLocator">
      <tag name="container.service_locator_context" id="service_subscriber_2"/>
      <argument>service_subscriber_2</argument>
      <argument type="service" id="service_container"/>
      <factory service=".service_locator.456xyz" method="withContext"/>
    </service>
    <service id=".service_locator.456xyz" class="Symfony\Component\DependencyInjection\ServiceLocator">
      <tag name="container.service_locator"/>
      <argument type="collection">
        <argument key="dummy_service_with_locator" type="service" id="dummy_private_service"/>
        <argument key="dummy_service_with_locator2" type="service" id="Psalm\SymfonyPsalmPlugin\Tests\Fixture\DummyPrivateService"/>
        <argument key="dummy_service_with_locator3" type="service_closure" id="Psalm\SymfonyPsalmPlugin\Tests\Fixture\DummyPrivateService"/>
        <argument key="validator" type="service" id="debug.validator"/>
        <argument key="1234" type="service" id="Psalm\SymfonyPsalmPlugin\Tests\Fixture\DummyPrivateService"/>
      </argument>
    </service>
    <!-- service locator example 3 -->
    <service id=".service_locator.890xyz.kernel::registerContainerConfiguration()" class="Symfony\Component\DependencyInjection\ServiceLocator">
      <tag name="container.service_locator_context" id="kernel::registerContainerConfiguration()"/>
      <argument>kernel::registerContainerConfiguration()</argument>
      <argument type="service" id="service_container"/>
      <factory service=".service_locator.890xyz" method="withContext"/>
    </service>
    <!-- excluded services still present in debug container -->
    <service id=".abstract.App\FooInterface" class="App\FooInterface" autowire="true" autoconfigure="true" abstract="true">
      <tag name="container.excluded" source="because the class is abstract"/>
    </service>
    <service id="App\Exception\FooException" class="App\Exception\FooException" abstract="true">
      <tag name="container.excluded" source="in &quot;config/services.php&quot;"/>
    </service>
  </services>
</container>
